{
  "catalog_version": "2026-10-19T00:00:00Z",
  "schema_version": "0.2.0",
  "generated_at": "2026-10-19T00:00:00Z",
  "source_versions": {
    "huggingface": "2026-10-18",
    "openml": "2026-10-18",
    "uci": "2026-10-18"
  },
  "record_counts": {
    "total": 1,
    "huggingface": 1,
    "openml": 0,
    "uci": 0
  },
  "stale_sources": [],
  "validation_summary": {
    "valid": true,
    "warnings": 0,
    "errors": 0
  }
}
